Meta75,Meta,2024,About Instagram Teen Accounts,https://help.instagram.com/995996839195964/?helpref=search&query=teen&search_session_id=a2bf3bf8ea1c5debe7fbc0da7bd42645&sr=6,Teens (13-17),Platform,Platform,Message Restrictions,Interpersonal Communication,,"CONNECTION_ONLY_MESSAGE, BLOCK_FOLLOWED, CONNECTION_ONLY_MENTIONS","PRIVATE_ACCOUNT, NO_FOLLOW, NO_MENTION",,NO_REMIX,"Tags, mentions and content remixing: Teen Accounts are automatically set to only allow tags and mentions by people who they follow. Content remixing is automatically set to people they follow and follow them back."
Meta75,Meta,2024,About Instagram Teen Accounts,https://help.instagram.com/995996839195964/?helpref=search&query=teen&search_session_id=a2bf3bf8ea1c5debe7fbc0da7bd42645&sr=6,Teens (13-17),Platform,Platform,Content Engagement Restrictions,Interpersonal Communication,,"CONNECTION_ONLY_MESSAGE, BLOCK_FOLLOWED, CONNECTION_ONLY_MENTIONS","PRIVATE_ACCOUNT, NO_FOLLOW, NO_MENTION",,,"Tags, mentions and content remixing: Teen Accounts are automatically set to only allow tags and mentions by people who they follow. Content remixing is automatically set to people they follow and follow them back."
Meta76,Meta,2022,About Instagram teen privacy and safety settings,https://help.instagram.com/3237561506542117/?helpref=search&query=teen&search_session_id=a2bf3bf8ea1c5debe7fbc0da7bd42645&sr=2,Teens (13-17),Platform,Platform,Content Engagement Restrictions,Interpersonal Communication,,NO_MENTION,,,,"Audience Controls
As of May 2022, when teens under 18 sign up for Instagram, accounts they don’t follow cannot tag, mention or use their content in Reels Remixes or Guides by default.
"
Meta76,Meta,2024,About Instagram teen privacy and safety settings,https://help.instagram.com/3237561506542117/?helpref=search&query=teen&search_session_id=a2bf3bf8ea1c5debe7fbc0da7bd42645&sr=2,Teens (13-17),Platform,Platform,Message Restrictions,Interpersonal Communication,,CONNECTION_ONLY_MESSAGE,,,,"Direct Messaging
We restrict adults over 18 from starting private chats with teens they're not connected to on Instagram and Messenger. Learn more about direct messaging for teens."
Meta76,Meta,2024,About Instagram teen privacy and safety settings,https://help.instagram.com/3237561506542117/?helpref=search&query=teen&search_session_id=a2bf3bf8ea1c5debe7fbc0da7bd42645&sr=2,Teens (13-17),Platform,Platform,Connection Controls,Interpersonal Communication,,SUSPICIOUS_ADULT_PROTECTION,,,,"Protections from Suspicious Adults
We’ve developed technology that allows us to find adult accounts that have shown potentially suspicious behavior, such as adults who have recently been blocked or reported by a young person. We stop these adult accounts from interacting with teen accounts the following ways:
We don’t show teen accounts in Explore, Reels or ‘Accounts Suggested For You’ to these adults.
If these adults find young people’s accounts by searching for their usernames, they do not have the option to follow them.
These adults are not able to see teen accounts when scrolling through the list of people who have liked a certain post.
These adults are not able to see comments from teens on other people’s posts.
These adults are not able to see teen accounts when scrolling through an account’s Followers or Following list.
If these adults follow a teen account, we may send that teen a notification prompting them to review and remove the new follower.
If these adults are already connected to a teen account and send the teen a direct message, we send a safety notice to the teen encouraging them to be cautious and provide options to end the conversation, block, report, or restrict the adult.
Note: All of the above interventions also apply to teen accounts' ability to discover, search, view or interact with suspicious adult accounts."
Meta90,Meta,2024,How Meta products and tools support age-appropriate experiences,https://about.meta.com/actions/safety/resource/f/871648470589685/,Teens (13-17),Platform,Platform,Message Restrictions,Interpersonal Communication,,CONNECTION_ONLY_MESSAGE,,,,"We restrict unwanted contact from
adults that teens don’t follow on
Instagram or who they do not have
mutual friends with on Facebook."
Meta90,Meta,2024,How Meta products and tools support age-appropriate experiences,https://about.meta.com/actions/safety/resource/f/871648470589685/,Teens (13-17),Platform,Platform,Content Engagement Restrictions,Interpersonal Communication,,CONNECTION_ONLY_MENTIONS,,,,"Keeping teens’ content private
We switch off the ability for people to
tag or mention teens who don’t follow
them, or to include their content in
Remixes on Reels or guides by default
when they first join Instagram."
Meta91,Meta,2024,Combating Financial Sextortion Scams From Nigeria,https://about.fb.com/news/2024/07/combating-financial-sextortion-scams-from-nigeria/,Teens (13-17),Platform,Platform,Message Restrictions,Interpersonal Communication,,CONNECTION_ONLY_MESSAGE,,,,"It’s why we default teens under 16 (under 18 in certain countries) into stricter message settings so they can’t be messaged by anyone — even other teens — they’re not connected to, and show Safety Notices encouraging them to be cautious"
Meta92,Meta,2024,We share new features that will help keep teens safer online.,https://about.fb.com/news/2024/01/introducing-stricter-message-settings-for-teens-on-instagram-and-facebook/,Teens (13-17),Platform,Platform,Message Restrictions,Interpersonal Communication,,CONNECTION_ONLY_MESSAGE,,,,"Stricter Message Settings
We’re taking additional steps to help protect teens from unwanted contact by turning off their ability to receive messages from anyone they don’t follow or aren’t connected to, by default. "
Snapchat11,Snapchat,2024,New Features to Help Protect Our Community,https://values.snap.com/news/new-features-to-help-protect-our-community?lang=en-US,Teens (13-17),Platform,Platform,Connection Controls,Interpersonal Communication,,"NO_FRIEND_REQUEST_FROM_PEOPLE_WITHOUT_MUTUAL_FRIENDS, NO_FRIEND_REQUEST_FROM_PEOPLE_IN_CERTAIN_LOCATIONS",,,,
Snapchat11_1,Snapchat,2023,Introducing New Safeguards to Protect our Community,https://values.snap.com/news/new-safeguards-for-snapchatters-2023?lang=en-US,Teens (13-17),Platform,Platform,Connection Controls,Interpersonal Communication,,STRICTER_LIMITS_ON_DISCOVERABILITY_IN_SEARCH,,,,
Snapchat13,Snapchat,2024,"Snapchat offers older teens 16+ an introduction to responsible public sharing with enhanced safeguards, education, and new parental tools",https://values.snap.com/news/public-profiles-16-17?lang=en-US,Teens (16-17),Platform/Teen,Platform & Teens,Message Restrictions,Interpersonal Communication,,"ONLY_REPLIES_TO_PUBLIC_STORIES_FROM_FOLLOWERS, NO_DIRECT_CHAT_FROM_REPLIES, STRICTER_REPLIES_FILTERING, POSSIBILITY_TURN_OFF_REPLIES",,,,"Designed for engagement from real friends: By default, all Snapchatters can only communicate directly with their mutually accepted friends or contacts saved in their phone. With public-posting options, older teens are able to receive Story replies on their public Stories from those who follow them, but cannot engage in direct chat conversations from those replies. Replies are filtered before they reach the creator – and that filtering is even stricter for Snapchatters ages 16 and 17. Snapchatters even have the option to turn off replies all together, or to block various terms to help them keep interactions respectful and fun. These Story replies from those who follow them are kept completely separate from Snapchatters' private conversations in their chat feed, and we have additional protections to help prevent content shared publicly from being a vector for unwanted friend requests from adults outside of a teens real friend network.  Limited distribution: Public Stories from 16- and 17-year olds will only be recommended to Snapchatters who are already their friends or followers, and to other Snapchatters with whom they share mutual friends. These public Stories are not distributed to the wider community in “Discover,” the section of our app where Snapchatters find a personalized viewing experience with content that’s relevant for them. Minimal metrics: Snapchatters ages 16 - 17 will not see how many people “favorited” their Stories or Spotlights, keeping the focus on creativity over pressure to collect public approval metrics. "
Snapchat15,Snapchat,2024,Our Work To Help Keep Snapchatters Safe,https://values.snap.com/news/keeping-snapchatters-safe?lang=en-US,Teens (13-17),Platform,Platform,Connection Controls,Interpersonal Communication,,"STRCITER_LIMITS_ON_DISCOVERABILITY_IN_SEARCH, EASIER_ACCESS_TO_BLOCKING_OPTION",,,,
Snapchat22,Snapchat,2024,How do I limit my teen’s access to My AI?,https://help.snapchat.com/hc/en-us/articles/22628526282772-How-do-I-limit-my-teen-s-access-to-My-AI,Teens (13-17),Parents,Parents,Message Restrictions,Interpersonal Communication,,DISABLE_MY_AI,,NO_MY_AI_PROCESSING_OF_TEENS_QUERIES,,"As a parent enrolled in Family Center, you can restrict your teen’s access to My AI. Find 'My AI' under Recent Conversations, then use the toggle to disable My AI. After My AI is disabled, My AI will be blocked from responding to your teen."
Snapchat33,Snapchat,2025,Your Privacy When You Post Publicly on Snapchat,https://help.snapchat.com/hc/en-us/articles/14855534914708-Your-Privacy-When-You-Post-Publicly-on-Snapchat,Teens (16-17),Platform,Platform,Message Restrictions,Interpersonal Communication,,"BLOCKING_USERS, ONLY_CHATS_WITH_REPLIERS_THAT_ARE_FRIENDS, STRICTER_REPLY_FILTERS",,,,"If you’re 16 or 17, you can view and quote replies to your public Story from people who follow you but you cannot communicate with them unless you’re mutually accepted friends. Protections against unwanted contact: Replies are filtered before they reach the creator – and that filtering is even stricter for Snapchatters ages 16 and 17"
TikTok1,TikTok,2019,musical.ly’s agreement with FTC,https://newsroom.tiktok.com/en-us/musical-lys-agreement-with-ftc ,ChildrenUnder13,Platform,Platform,Message Restrictions,Interpersonal Communication,,"NO_COMMENTING, NO_MESSAGING, NO_FOLLOWERS",,,,The new environment for younger users puts extensive limitations on user interaction
TikTok10,TikTok,2020,TikTok joins WePROTECT Global Alliance to combat online child sexual exploitation and abuse,https://newsroom.tiktok.com/en-us/tiktok-joins-weprotect-global-alliance,Teens (13-17),Platform,Platform,Message Restrictions,Interpersonal Communication,,DEFAULT_NO_MESSAGING_UNDER_16,,,,restrict under-16s’ access to its Direct Messaging feature is one example of its willingness to put child safety first.
TikTok11,TikTok,2020,TikTok proposes global coalition to protect against harmful content,https://newsroom.tiktok.com/en-us/tiktok-proposes-global-coalition-to-protect-against-harmful-content,Teens (13-17),Platform/Teen/Parent,Platform & Parents & Teens,Message Restrictions,Interpersonal Communication,,MESSAGING_CONTROLS,,,,"Our commitment to keeping our users safe encompasses a broad effort which also includes features like Family Pairing, which we built to give parents better coordination with their teens; resources and education for our community, like our Youth Portal or educational safety videos; and industry partnerships we forge to collaborate and learn from others like the WePROTECT Global Alliance. "
TikTok14,TikTok,2020,Supporting youth and families on TikTok,https://newsroom.tiktok.com/en-us/supporting-youth-and-families-on-tiktok,ChildrenUnder13,Platform,Platform,Message Restrictions,Interpersonal Communication,,"NO_COMMENTING, NO_MESSAGING, NO_FOLLOWERS",,,,"In the US, we accommodate those under the age of 13 in TikTok for Younger Users, a view-only experience with curated content and additional safety and privacy protections designed specifically for an under-13 audience. In this ecosystem, users can experience and make fun, creative, and even educational videos but cannot post those videos, comment on others' videos, message with others, or maintain a profile or followers."
TikTok14,TikTok,2020,Supporting youth and families on TikTok,https://newsroom.tiktok.com/en-us/supporting-youth-and-families-on-tiktok,Teens (13-17),Parent,Parents,Message Restrictions,Interpersonal Communication,,MESSAGING_CONTROLS,,,,
TikTok16,TikTok,2020,Supporting creative expression in 2020 and beyond,https://newsroom.tiktok.com/en-us/year-on-tiktok-trust-and-safety-2020,Teens (13-17),Platform,Platform,Message Restrictions,Interpersonal Communication,,NO_MESSAGING_UNDER_16,,,,"With their input, we developed Family Pairing and our Youth Portal to educate teens about digital literacy and foster conversations about online safety within families. Based on youth-safety research, direct messaging and live streaming aren’t available for registered accounts under 16 as we work to reduce the potential for negative experiences or harm. "
TikTok17,TikTok,2021,Strengthening privacy and safety for youth on TikTok,https://newsroom.tiktok.com/en-us/strengthening-privacy-and-safety-for-youth,ChildrenUnder13,Platform,Platform,Content Engagement Restrictions,Interpersonal Communication,,,VIEW_ONLY,,,"In the US, we accommodate users under 13 in a limited app experience, TikTok for Younger Users, which offers additional safeguards and privacy protections designed specifically for a younger audience. This experience allows users to browse a curated library of age-appropriate videos"
TikTok17,TikTok,2021,Strengthening privacy and safety for youth on TikTok,https://newsroom.tiktok.com/en-us/strengthening-privacy-and-safety-for-youth,Teens (13-15),Platform,Platform,Message Restrictions,Interpersonal Communication,,"NO_MESSAGING_UNDER_16, NO_LIVE_STREAMING_UNDER_16",,,,
TikTok18,TikTok,2021,Three TikTok features every parent should know,https://newsroom.tiktok.com/en-us/three-tiktok-features-every-parent-should-know,Teens (13-17),Parent,Parents,Message Restrictions,Interpersonal Communication,,"COMMENT_SETTINGS_FRIENS, NO_DIRECT_MESSAGING_SETTINGS, DIRECT_MESSAGING_SETTINGS",,,,"You also have the ability to choose who is allowed to comment on your teen's videos (either friends or no one), putting you in the driver's seat in managing who can engage with your teen on TikTok. you can also manage who can send your teen direct messages, or you can turn off direct messaging completely."
TikTok18,TikTok,2021,Three TikTok features every parent should know,https://newsroom.tiktok.com/en-us/three-tiktok-features-every-parent-should-know,Teens (13-17),Parent,Parents,Content Engagement Restrictions,Interpersonal Communication,,NO_COMMENTING_SETTINGS,,,,"You also have the ability to choose who is allowed to comment on your teen's videos (either friends or no one), putting you in the driver's seat in managing who can engage with your teen on TikTok. you can also manage who can send your teen direct messages, or you can turn off direct messaging completely."
TikTok25,TikTok,2021,Furthering our safety and privacy commitments for teens on TikTok,https://newsroom.tiktok.com/en-us/furthering-our-safety-and-privacy-commitments-for-teens-on-tiktok-us,ChildrenUnder16,Platform,Platform,Message Restrictions,Interpersonal Communication,,NO_DIRECT_MESSAGING,,,,"disabling messaging for accounts under age 16. To help teens understand the sharing options available to them we're now adding a pop-up that appears when teens under the age of 16 are ready to publish their first video, asking them to choose who can watch the video. Duet and Stitch are also disabled for accounts under 16. Note that downloads are permanently disabled on content from accounts under the age of 16.

"
TikTok25,TikTok,2021,Furthering our safety and privacy commitments for teens on TikTok,https://newsroom.tiktok.com/en-us/furthering-our-safety-and-privacy-commitments-for-teens-on-tiktok-us,Teens (13-15),Platform,Platform,Notification Settings,Platform Usage Patterns,,,NO_PUSH_NOTIFICATIONS_AFTER_9PM,,,Accounts aged 13-15 will not receive push notifications from 9pm
TikTok25,TikTok,2021,Furthering our safety and privacy commitments for teens on TikTok,https://newsroom.tiktok.com/en-us/furthering-our-safety-and-privacy-commitments-for-teens-on-tiktok-us,Teens (16-17),Platform/Teen,Platform & Teens,Message Restrictions,Interpersonal Communication,,"DEFAULT_NO_DIRECT_MESSAGING, NO_IMAGES_SENT_IN_MESSAGES, NO_VIDEOS_SENT_IN_MESSAGES, EXTRA_INFORMATION_DOWNLOAD_SETTINGS",,,,"when someone aged 16-17 joins TikTok, their Direct Messaging setting will now be set to 'No One' by default. These updates build on our current messaging protections, such as not allowing images or videos to be sent in messages. "
TikTok25,TikTok,2021,Furthering our safety and privacy commitments for teens on TikTok,https://newsroom.tiktok.com/en-us/furthering-our-safety-and-privacy-commitments-for-teens-on-tiktok-us,Teens (16-17),Platform,Platform,Notification Settings,Platform Usage Patterns,,,NO_PUSH_NOTIFICATIONS_AFTER_10PM,,,accounts aged 16-17 will have push notifications disabled starting at 10pm
TikTok25_1_1,TikTok,2020,Introducing Family Safety Mode and Screentime Management in Feed,https://newsroom.tiktok.com/en-gb/family-safety-mode-and-screentime-management-in-feed,Teens (13-17),Parent,Parents,Message Restrictions,Interpersonal Communication,,CONTROL_DIRECT_MESSAGING,,,,Screen Time Management: Control how long their teen can spend on TikTok each day. Direct Messages: Limit who can send messages to the connected account or turn off direct messaging completely. Restricted Mode: Restrict the appearance of content that may not be appropriate for all audiences.
TikTok4,TikTok,2019,TikTok Parental Guide,https://newsroom.tiktok.com/en-us/tiktok-parental-guide,Teens (13-17),Platform/Teen,Platform & Teens,Message Restrictions,Interpersonal Communication,,"NO_CHATTING_FOR_NON-FOLLOWERS, CONTROL_COMMENT_SETTINGS",,,,"If you switch to a private account you can approve or deny follower requests, and only users you’ve approved as followers can see your content. we give you the option to decide who can make duets with or react to your content. You can let anyone comment, restrict it to friends, or turn off comments completely."
TikTok42,TikTok,2022,Helping families to have digital safety conversations,https://newsroom.tiktok.com/en-us/helping-families-to-have-digital-safety-conversations,Teens (13-17),Parents,Parents,Content Engagement Restrictions,Interpersonal Communication,,CONTROL_COMMENT_SETTINGS,,,,"Family Pairing allows parents and guardians to link their accounts with those of their teens and set a variety of privacy and safety controls, such as managing screen time limits, setting a teen's account to private, and deciding who can comment on their videos."
TikTok46,TikTok,2023,New features for teens and families on TikTok,https://newsroom.tiktok.com/en-us/new-features-for-teens-and-families-on-tiktok-us,Teens (13-17),Parent,Parents,Notification Settings,Platform Usage Patterns,,,CONTROL_NOTIFICATION_SETTINGS,,,"Caregivers will be able to use Family Pairing to customize the daily screen time limit for their teen – including choosing different time limits depending on the day of the week – giving families more choices to match screen time to school schedules, holiday breaks, or family travel. We're bringing our screen time dashboard to Family Pairing, which provides summaries of time on the app, the number of times TikTok was opened, and a breakdown of total time spent during the day and night. We're introducing a new setting that enables parents to set a schedule to mute notifications for their teen."
TikTok5,TikTok,2019,TikTok for Younger Users,https://newsroom.tiktok.com/en-us/tiktok-for-younger-users,ChildrenUnder13,Platform,Platform,Message Restrictions,Interpersonal Communication,,"NO_COMMENTING, NO_MESSAGING",,,,"We accommodate users under the age of 13 in a limited app experience - ""TikTok for Younger Users"" - that introduces additional safety and privacy protections designed specifically for an audience that is under 13 years old. Within TikTok for Younger Users, users are provided a viewing experience that does not permit sharing of personal information and puts extensive limitations on content and user interaction. In this ecosystem, users cannot do things like share their videos, comment on others' videos, message with users, or maintain a profile or followers."
TikTok55,TikTok,2024,"TikTok CEO Shou Chew's Opening Statement - Senate Judiciary Committee Hearing on Online Child Sexual Exploitation Crisis - January 31, 2024",https://newsroom.tiktok.com/en-us/opening-statement-senate-judiciary-committee-hearing,ChildrenUnder16,Platform,Platform,Message Restrictions,Interpersonal Communication,,NO_MESSAGING,,,,"First, direct messaging is not available to anyone under 16. Second, accounts for people under 16 are automatically set to private along with their content. Furthermore, their content cannot be downloaded. And will not be recommended to people they do not know."
TikTok57,TikTok,2024,Share your favorite TikTok moments with Direct Messaging,https://newsroom.tiktok.com/en-us/share-your-favorite-tiktok-moments-with-direct-messaging,ChildrenUnder16,Platform,Platform,Message Restrictions,Interpersonal Communication,,"NO_MESSAGING, NO_GROUP_CHATS",,,,"Group Chat, like Direct Messaging, is not available for those ages 13 to 15"
TikTok57,TikTok,2024,Share your favorite TikTok moments with Direct Messaging,https://newsroom.tiktok.com/en-us/share-your-favorite-tiktok-moments-with-direct-messaging,Teens (16-17),Platform,Platform,Message Restrictions,Interpersonal Communication,,"ONLY_ADDING_TO_GROUP_CHAT_BY_FRIENDS, ONLY_JOINING_GROUP_CHATS_WITH_FRIENDS, MANDATORY_APPROVAL_OF_NEW_JOINERS_IN_GROUP_CHATS",,,,"Everyone, including teens, can only be added to a Group Chat by their friends (people they follow who also follow them). If a teen is sent a link to join a group conversation, they will not be able to join unless the group includes at least one mutual friend. If they are eligible to join, they will be required to make a proactive decision to join. When a teen creates a group conversation, by default we will require them to review and approve new joiners."
TikTok59,TikTok,2024,Community controls,https://www.tiktok.com/safety/en/community-controls,ChildrenUnder16,Platform,Platform,Message Restrictions,Interpersonal Communication,,"NO_MESSAGING, DEFAULT_COMMENT_SETTINGS_TO_FRIENDS, COMMENT_OPTIONS_FRIENDS_OR_NO_ONE, NO_DOWNLOADING_THEIR_VIDEOS",,,,Direct Messages are only available to registered accounts who are 16 and older. People under 16 and people with a private account cannot have their videos downloaded
TikTok59,TikTok,2024,Community controls,https://www.tiktok.com/safety/en/community-controls,Teens (16-17),"Platform, Teen, Parent",Platform & Parents & Teens,Message Restrictions,Interpersonal Communication,,"MESSAGING_RESTRICTIONS, PARENTAL_CONTROL_MESSAGING_SETTINGS, COMMENT_OPTIONS_EVRYONE_FRIENDS_OR_NO_ONE, DEFAULT_NO_DOWNLOADING_THEIR_VIDEOS",,,,"parent or caregiver can restrict or turn off with Family Pairing. Direct Messages can be set to ‘Everyone,’ ‘Friends’ (followers that you follow back), or ‘No one.’ People 16-17 also have this setting turned off by default, with the option to enable it in their Privacy settings. "
TikTok6,TikTok,2020,Protecting against exploitative content,https://newsroom.tiktok.com/en-us/protecting-against-exploitative-content,ChildrenUnder18,Platform,Platform,Message Restrictions,Interpersonal Communication,,"NO_IMAGES_IN_COMMENTS, NO_VIDEOS_IN_COMMENTS, NO_IMAGES_SENT_IN_MESSAGES, NO_VIDEOS_SENT_IN_MESSAGES, ENGAGEMENT_RESTRICTIONS, COMMENT_FILTERS, DISABLING_MESSAGES, BLOCKING_USERS",,,,"Unlike other platforms, we don't permit images or videos to be sent in comments or messages. In addition to reporting, we've built numerous controls into the app for users and families – such as the ability to make an account private, restrict who can engage with content, filter comments, disable messages, or block another user."
TikTok63,TikTok,2025,Teen Safety Center,https://www.tiktok.com/safety/en/youth-portal-1,ChildrenUnder16,Platform,Platform,Message Restrictions,Interpersonal Communication,,"NO_MESSAGING, COMMENT_OPTIONS_FRIENDS_OR_NO_ONE, NO_GOING_LIVE",,,,"No one can:
Send you direct messages."
TikTok63,TikTok,2025,Teen Safety Center,https://www.tiktok.com/safety/en/youth-portal-1,Teens (16-17),"Platform, Teen",Platform & Teens,Message Restrictions,Interpersonal Communication,,"DEFAULT_MESSAGING_SETTING_NO_ONE, DEFAULT_NO_SUGGESTING_ACCOUNT_TO_OTHERS, NO_GOING_LIVE",,,,"You can choose between a private or public account when you sign up for TikTok.
If you don't choose a public account or select the option Remind me later, your account is automatically set to private.
If you choose a public account, you can also always adjust your Settings to be more private.
You can control and manage who can:
Follow your profile, depending on your Settings.
See your content, followers, and following lists, depending on your Settings.
Duet, Stitch, or download your videos, depending on your Settings.
View and post comments on your videos. This control is automatically set to Followers for private accounts and Everyone for public accounts.
Send you direct messages. This control is automatically set to No one.
Create stickers from your videos. This control is automatically set to Only me for private accounts and Friends for public accounts.
Suggest your account to others is automatically set to Off. You can turn this On in Privacy settings.
You can watch TikTok LIVE but can't go LIVE or send a Gift during a LIVE"
TikTok67,TikTok,2025,Guardian's guide,https://www.tiktok.com/safety/en/guardians-guide,Teens (13-17),Platform,Platform,Message Restrictions,Interpersonal Communication,,"NO_DIRECT_MESSAGING, NO_GROUPCHATS",,,,
