Index,Platform,Year of first publishment,Articles,Article links,Age (for whom to be protected),For whom to use/control the safety features,WhoUseControl,SafetyFeatures,Problemarea,Content,Contact,Conduct,Contract,Circulation,Quotes
Meta1_2,Meta,2024,Supporting your child’s Teen Account,https://help.instagram.com/1555818391956130,Teens (13-15),Parents,Parents,Parental Control Settings,Parental Supervision,,,REVIEW_SAFETY_SETTINGS,,,"For parents and guardians of teens 16-17
Teens 16-17 can manage their own teen safety settings if they don’t have supervision set up. You can invite your teen to let you supervise their account, or they can invite you to supervise their account, which means you’ll approve or deny their teen safety setting changes and help them balance their time on Instagram. You can also make some of their settings even more protective. Supervision on Instagram is automatically removed when a teen turns 18."
Meta1_3,Meta,2021,How Do We Know Someone Is Old Enough to Use Our Apps?,https://about.fb.com/news/2021/07/age-verification/,ChildrenUnder13,Platform,Platform,Age Verification,Platform Access,,,,REPORTTING_ACCOUNT,,"We’re developing AI to find and remove underaged accounts, and new solutions to verify people’s ages"
Snapchat34,Snapchat,2024,What makes Snaps eligible for Spotlight?,https://help.snapchat.com/hc/en-us/articles/7012300442132-What-makes-Snaps-eligible-for-Spotlight,Teens (13-15),Platform,Platform,Content Creation Restrictions,Content Creation,,AGE_RESTRICTIONS_FOR_SPOTLIGHT,MINIMUM_AGE_OF_13,,,"Not everyone who is eligible for a Snapchat account (age 13+) can submit to Spotlight, in some markets you need to be 16+ such as France, Germany, and Ireland. Only Snapchatters who have a Public Profile can have their display name associated with their Spotlight Snap"
TikTok59,TikTok,2024,Community controls,https://www.tiktok.com/safety/en/community-controls,ChildrenUnder16,Platform,Platform,Content Collaboration Restrictions,Content Creation,,"DEFAULT_PRIVATE_ACCOUNT, DEFAULT_NO_SUGGESTING_ACCOUNT_TO_OTHERS",,,NO_DOWNLOADING_THEIR_VIDEOS,
Meta32,Meta,2021,Asking People for Their Birthdays,https://about.instagram.com/blog/announcements/asking-people-for-their-birthdays,Teens (13-17),Platform,Platform,Age Verification,Platform Access,,,,ADDITIONAL_PROOF,,"First, we’ll start to ask you for your birthday when you open Instagram. We’ll show you a notification a handful of times and if you haven’t provided us with your birthday by a certain point, you’ll need to share it to continue using Instagram. This information is necessary for new features we’re developing to protect young people.

Three phones in a row displaying the different steps to add your birthday in Instagram.
Second, if you see warning screens placed on posts, we’ll ask you for your birthday before you can see the post. These screens aren’t new, and we already show them on posts that may be sensitive or graphic, but we don’t currently ask for your birthday when viewing these posts. Now, we’ll start asking for your birthday on some of these screens if you haven’t shared it with us previously.

Three phones in a row displaying a warning screen on a Instagram post and the prompt screen to add your birthday.
We recognize some people may give us the wrong birthday, and we’re developing new systems to address this. As we shared recently, we’re using artificial intelligence to estimate how old people are based on things like “Happy Birthday” posts. In the future, if someone tells us they’re above a certain age, and our technology tells us otherwise, we’ll show them a menu of options to verify their age. This work is still in the early stages, and we look forward to sharing more soon.

We hope this explains why we’re starting to ask some people for their birthday, and why it is so important for our efforts to provide safer, more private experiences for young people. For more information, head to our Help Center."
Meta4,Meta,2013,Exploitation,https://help.instagram.com/659118497466447/?helpref=search&query=teen&search_session_id=a2bf3bf8ea1c5debe7fbc0da7bd42645&sr=35,ChildrenUnder13,Platform,Platform,Age Verification,Platform Access,,,,REPORTTING_ACCOUNT,,"You can also report a profile for posting content it shouldn't be, pretending to be someone else, or for being a child under the age of 13."
Meta41,Meta,2021,How Do We Know Someone Is Old Enough to Use Our Apps?,https://about.fb.com/news/2021/07/age-verification/,Teens (13-17),Platform,Platform,Age Verification,Platform Access,,,,AGE_DETECTION,,"Using AI to Detect Age
Artificial intelligence is the cornerstone of the approach we’re taking. We’ve developed technology that allows us to estimate people’s ages, like if someone is below or above 18. We train the technology using multiple signals. We look at things like people wishing you a happy birthday and the age written in those messages, for example, “Happy 21st Bday!” or “Happy Quinceañera.” We also look at the age you shared with us on Facebook and apply it to our other apps where you have linked your accounts and vice versa — so if you share your birthday with us on Facebook, we’ll use the same for your linked account on Instagram. This technology isn’t perfect, and we’re always working to improve it, but that’s why it’s important we use it alongside many other signals to understand people’s ages. "
Meta44,Meta,2022,Introducing New Ways to Verify Age on Instagram,https://about.instagram.com/blog/announcements/new-ways-to-verify-age-on-instagram,Teens (13-17),Platform,Platform,Age Verification,Platform Access,,,ADDITIONAL_PROOF,,,"We’re testing new options for people to verify their age on Instagram, allowing us to provide age-appropriate experiences.
In addition to providing an ID, people will now be able to ask others to vouch for their age, or use technology that can confirm their age based on a video selfie.
We’re partnering with Yoti, a company that specializes in privacy-preserving ways to verify age.
Starting today, we’re testing new options for people on Instagram to verify their age, starting with people based in the US. If someone attempts to edit their date of birth on Instagram from under the age of 18 to 18 or over, we’ll require them to verify their age using one of three options: upload their ID, record a video selfie or ask mutual friends to verify their age. We’re testing this so we can make sure teens and adults are in the right experience for their age group. We are also partnering with Yoti, a company that specializes in online age verification, to help ensure people’s privacy.

In 2019, we began asking people to provide their age when signing up for Instagram. Since then, we’ve made this a requirement. Knowing people’s age allows us to provide appropriate experiences to different age groups, specifically teens."
Meta5,Meta,2013,Report a child under 13 on Instagram,https://help.instagram.com/517920941588885/?helpref=search&query=teen&search_session_id=a2bf3bf8ea1c5debe7fbc0da7bd42645&sr=33,ChildrenUnder13,Platform,Platform,Age Verification,Platform Access,,,,REPORTTING_ACCOUNT,,"Instagram requires everyone to be at least 13 years old before they can create an account (some regions like South Korea, Spain or Quebec have different age requirements). Accounts that represent someone under the age of 13 must clearly state in the account’s bio that the account is managed by a parent or manager, and provide identification to prove the account is run by an adult if requested. If your child is younger than 13 and has an account that isn’t managed by you or a manager, the account will be deleted."
Meta6,Meta,2013,Underage Children,https://help.instagram.com/290666591035380/?helpref=search&query=teen&search_session_id=a2bf3bf8ea1c5debe7fbc0da7bd42645&sr=7,ChildrenUnder13,Platform,Platform,Age Verification,Platform Access,,,,REPORTTING_ACCOUNT,,"If you'd like to report an account belonging to someone under 13 or if you believe someone is impersonating your child who's under 13, please fill out this form. We will delete the account if we can't verify the account is managed by someone over 13 years old."
Meta78,Meta,2024,Confirming your age on Instagram,https://help.instagram.com/966909308115586/?helpref=search&query=teen&search_session_id=a2bf3bf8ea1c5debe7fbc0da7bd42645&sr=26,Teens (13-17),Platform,Platform,Age Verification,Platform Access,,,,ADDITIONAL_PROOF,,"We require people to be at least 13 years old to sign up for Instagram. In some regions, you may be required to confirm your age to continue using your account. You may also be required to verify your age to access certain features or to change your birthday on your account. You can confirm your age by providing your birthday, photo identification, and/or submitting a video selfie. You can learn more about confirming your age in Newsroom. If you need to confirm your age on Instagram, you’ll be asked for additional information to help us verify your age.
We partner with Yoti, a third party age verification service, to confirm people’s ages on Instagram. Yoti is verified by the Age Check Certification Scheme and is the leading age verification provider for several industries around the world including social media, gaming and age restricted e-commerce.
With Yoti, you can verify your age on Instagram by taking a video selfie or uploading your ID."
Meta90,Meta,2024,How Meta products and tools support age-appropriate experiences,https://about.meta.com/actions/safety/resource/f/871648470589685/,Teens (13-17),Platform,Platform,Age Verification,Platform Access,,,,AGE_DETECTION,,"Age verification tools
Our age verification tools, which are
accessible and privacy-preserving,
help us provide people on Instagram
with age-appropriate experiences.
Using AI to detect if someone
is an adult or teen
AI helps us better understand a
person’s age and is used to help
make sure teens are provided with
age-appropriate experiences. This
includes restricting teens from
accessing Facebook Dating, receiving
messages from unknown adults or
seeing restricted ad content."
Snapchat8_2_1_1,Snapchat,2024,Parent's Guide: Snapchat's Family Center,https://assets.ctfassets.net/gqgsr8avay9x/53kgZIyFD6i4TbPpgzK5r2/4e679d035e89ebda2ab1b47e1c9f1428/20220728_SNAP_FamilyCenter_ParentsGuide.pdf?lang=en-GB,Teens (13-17),Platform,Platform,Age Verification,Platform Access,,,,NO_UPDATING_BIRTHDAY_TO_ADULT,,We have safeguards against trying to circumvent our protections for minors. We prevent younger Snapchatters with existing accounts from updating their birthday to an age of 18 or above. We also use age-gating tools to prevent minors from viewing age-regulated content and ads.
TikTok6,TikTok,2020,Protecting against exploitative content,https://newsroom.tiktok.com/en-us/protecting-against-exploitative-content,ChildrenUnder18,Platform,Platform,Content Removal,Content Exposure,,FILTERING_RED_FLAG_LANGUAGE,"REPORTING_CONTENT, REPORTING_ACCOUNTS",,CONTENT_REMOVAL,"We prohibit content that depicts or disseminates child abuse, child nudity, or sexual exploitation of children in digital or real world format. If we become aware of any such content we will take immediate action to remove content, terminate accounts, and report cases to NCMEC and law enforcement as appropriate.  "
YouTube11,YouTube,2023,4 ways we’re empowering viewers of all ages to experience a safer internet,https://blog.youtube/news-and-events/empowering-viewers-of-all-ages-to-safer-internet/,ChildrenUnder13,Parents,Parents,Individual Kid Profile,Parental Supervision,,,,KID_PROFILE,,"YouTube Kids gives signed-in parents all the controls to customize the experience to the specific needs of their youngest kids. They can make a profile for each child with individual settings,"
YouTube14_1,YouTube,2021,YouTube Kids profile vs. Google Account for kids,https://support.google.com/youtubekids/answer/7555328,ChildrenUnder13,Parents,Parents,Individual Kid Profile,Parental Supervision,,,KID_PROFILE,,,"A YouTube Kids profile is a profile within a parent's Google Account. Profiles are available only when the parent is signed in to YouTube Kids with their Google Account.

te: You can’t set up Restricted Mode for your child if they:

Are over 13 (or the relevant age in your country/region), unless you created their supervised Google Account before they reached this age."
Snapchat15,Snapchat,2024,Our Work To Help Keep Snapchatters Safe,https://values.snap.com/news/keeping-snapchatters-safe?lang=en-US,Teens (13-17),Platform/Teen,Platform & Teens,Content Recommendation Restrictions,Content Exposure,,IN_CHAT_REPORTING,,,CONTENT_REMOVAL,"Last year we launched in-app chat text reporting – which enables Snapchatters to report individual messages directly from the conversation itself. We also expanded our in-app reporting tools to include a specific, tailored reporting reason for sextortion and, on advice and guidance from the CSEA-fighting NGO Thorn, presented that reporting option in relatable language for teens and young people (“They leaked / are threatening to leak my nudes”). "
YouTube24_1,YouTube,2020,Important info for parents about YouTube Kids,https://support.google.com/youtubekids/answer/6130561?hl=en&ref_topic=12984397#zippy=,ChildrenUnder13,Parents,Parents,Individual Kid Profile,Parental Supervision,,,KID_PROFILE,,,"YouTube Kids profiles
YouTube Kids allows signed in parents to create a separate profile for each kid in their household. Each profile has a separate set of viewing preferences and recommendations, allowing multiple kids to get the most out of the YouTube Kids app.
Profiles are available on devices where:

The parent is signed in, and
The YouTube Kids app is installed.
You can have up to eight profiles. Learn how to create a profile.

Note: You can also use YouTube Kids without signing in at all."
YouTube24_2,YouTube,2020,Create a YouTube Kids profile,https://support.google.com/youtubekids/answer/7554914?hl=en&ref_topic=12984597&sjid=6571883417605309189-NA,ChildrenUnder13,Parents,Parents,Individual Kid Profile,Parental Supervision,,,8_KID_PROFILE,,,"Create a profile
Kid profiles are only accessible within the YouTube Kids app and only when a parent is signed in. You can add up to 8 profiles per account."
YouTube2,YouTube,2019,An update on our efforts to protect minors and families,https://blog.youtube/news-and-events/an-update-on-our-efforts-to-protect/,ChildrenUnder18,Platform,Platform,Content Recommendation Restrictions,Content Exposure,,NO_COMMENT,,,REDUCED_RECOMMENDATION,"We updated enforcement of our live streaming policy to specifically disallow younger minors from live streaming unless they are clearly accompanied by an adult. Channels not in compliance with this policy may lose their ability to live stream. We also launched new classifiers (machine learning tools that help us identify specific types of content) on our live products to find and remove more of this content.

We disabled comments on tens of millions of videos featuring minors across the platform, to limit the risk of exploitation

We expanded our efforts from earlier this year around limiting recommendations of borderline content to include videos featuring minors in risky situations. While the content itself does not violate our policies, we recognize the minors could be at risk of online or offline exploitation"
TikTok63,TikTok,2025,Teen Safety Center,https://www.tiktok.com/safety/en/youth-portal-1,ChildrenUnder16,Platform,Platform,Content Collaboration Restrictions,Content Creation,,"NO_DUET_NO_STITCH, NO_STICKERS_OUT_OF_VIDEOS, NO_DOWNLOADING_THEIR_VIDEOS",,,,"No one can:
Duet, Stitch, or download your videos. Create stickers from your videos."
TikTok41,TikTok,2022,"Enhancing the LIVE community experience with new features, updates, and policies",https://newsroom.tiktok.com/en-us/enhancing-the-live-community-experience,Teens (13-17),Platform,Platform,Audience Age Settings,Content Exposure,,POSSIBLE_AGE_RESTRICTIONS_LIVE_CONTENT,,,,"Currently, people must be aged 16 or over to host a LIVE. From November 23, the minimum age will increase from 16 to 18. In addition, in the coming weeks, we plan to introduce a new way for creators to choose if they'd prefer to only reach an adult audience in their LIVE."
TikTok3,TikTok,2019,TikTok's Top 10 Tips for Parents,https://newsroom.tiktok.com/en-us/tiktoks-top-10-tips-for-parents,Teens (13-17),Teen,Teens,Reporting Content,Content Exposure,REPORT_CONTENT,REPORT_USERS,,,,"If your teen sees anything that they believe violates these guidelines, they can report content or a profile directly from within the app."
YouTube6,YouTube,2020,Using technology to more consistently apply age restrictions,https://blog.youtube/news-and-events/using-technology-more-consistently-apply-age-restrictions/,ChildrenUnder18,Platform,Platform,Age Verification,Platform Access,,,PROOF_UPLOAD,,,"we will also be introducing a new age verification step over the next few months.  As part of this process some European users may be asked to provide additional proof of age when attempting to watch mature content. If our systems are unable to establish that a viewer is above the age of 18, we will request that they provide a valid ID or credit card to verify their age. "
YouTube60,YouTube,2024,Explore your Family Center,https://support.google.com/youtube/answer/15255618?hl=en&co=GENIE.Platform%3DDesktop,ChildrenUnder13,Parents,Parents,Individual Kid Profile,Parental Supervision,,,KID_PROFILE,,,"From the Family Center, you can also create new YouTube Kids profiles or a"
YouTube7,YouTube,2021,A new choice for parents of tweens and teens on YouTube,https://blog.youtube/news-and-events/supervised-experiences-for-families-on-youtube/,ChildrenUnder18,Parents,Parents,Platform Access Control,Platform Access,,,GRANT_PLATFORM_ACCESS,,,"When a parent grants access to YouTube, their child’s experience will feel much like regular YouTube, but certain features will be disabled to protect younger audiences"
YouTube7_1,YouTube,2021,Exploration starts here,https://www.youtube.com/myfamily/,ChildrenUnder13,Parents,Parents,Individual Kid Profile,Parental Supervision,,,KID_PROFILE,,,"Create individual profiles as unique as your kids

With personalized content selections and settings"
YouTube7_3,YouTube,2020,Create a Google Account for your child,https://support.google.com/families/answer/7103338?hl=en&ref_topic=7336731,ChildrenUnder13,Parents,Parents,Platform Access Control,Platform Access,,,GRANT_PLATFORM_ACCESS,,,"With a supervised Google Account, your child gets access to Google products like Search, Chrome, and Gmail. You can set up parental controls to help supervise them."
YouTube7_6,YouTube,2020,📢 YouTube Kids on Apple TV Title & Amazon Fire TV Devices,https://support.google.com/youtubekids/thread/49349707?hl=en,ChildrenUnder13,Parents,Parents,Platform Access Control,Platform Access,,,,,,"Parent Controls
If you choose to sign into the app on your TV, your parent controls and settings will transfer to the YouTube Kids experience on Apple TV. If you want to change any of your settings, you can do so in the app on a tablet or phone. Learn more in this Help Center article here."
YouTube7_8,YouTube,2016,Tips and tools for your family,https://www.youtube.com/kids/parent-resources/,ChildrenUnder13,Parents,Parents,Individual Kid Profile,Parental Supervision,,,,KID_PROFILE,,"Create individual profiles as unique as your kids.
Sign in and create up to eight kid profiles, each with its own content level selections, video recommendations and settings."
Meta11,Meta,2016,Why Instagram has age requirements,https://help.instagram.com/801322493288277/?helpref=search&query=youth&search_session_id=6bdc0e5502268f7d72d5ef137ca0068d&sr=30,Teens (13-17),Teem & Platform,Platform & Teens,Audience Age Settings,Content Exposure,RESTRICTED_ACCOUNT,,,,,"Why Instagram has age requirements
Some accounts, like alcohol brands, post content that’s meant for older audiences. These accounts may choose to restrict their content to people who are over a certain age. To determine whether you're able to see a restricted account, we may use information you provide on Instagram or on Facebook.
You may need to update your Instagram app to the most recent version to see restricted accounts.
"
Meta26,Meta,2020,Set up a minimum age for your Instagram account,https://help.instagram.com/853772598370828/?helpref=search&query=age&search_session_id=6cd497fe16568415a41d1b1ef5d5f6fe&sr=3,Teens (13-17),Teen Creator & Platform,Platform & Teens,Audience Age Settings,Content Exposure,MINIMUM_AGE,,,,,"You have the ability to control the age of your Instagram content’s viewers by setting up a minimum age for your account. You can choose to set up a default minimum age that will be applied everywhere, or you can set up country-specific minimum ages to follow local policies."
YouTube19,YouTube,2019,Set your channel or video’s audience,https://support.google.com/youtube/answer/9527654?hl=en&co=GENIE.Platform%3DAndroid,ChildrenUnder13,General Creators & Platform,General Creators & Platform,Audience Age Settings,Content Exposure,AUDIENCE_SETTING,,,,,"As a YouTube creator, you are required to set future and existing videos as made for kids or not. Even creators who don’t make content for kids need to set their audience. This will help ensure that we offer the appropriate features on your content."
YouTube25,YouTube,2020,Frequently asked questions about “made for kids”,https://support.google.com/youtube/answer/9684541?hl=en,ChildrenUnder13,General Creators & Platform,General Creators & Platform,Audience Age Settings,Content Exposure,AUDIENCE_SETTING,,,,,"Regardless of your location, you’re legally required to comply with the Children’s Online Privacy Protection Act and/or other laws. You’re required to tell us that your videos are made for kids if you make kids’ content"
YouTube3,YouTube,2019,An update on kids and data protection on YouTube,https://blog.youtube/news-and-events/an-update-on-kids/,ChildrenUnder13,General Creators & Platform,General Creators & Platform,Audience Age Settings,Content Exposure,AUDIENCE_SETTING,,,,,"In order to identify content made for kids, creators will be required to tell us when their content falls in this category, and we’ll also use machine learning to find videos that clearly target young audiences, for example those that have an emphasis on kids characters, themes, toys, or games."
YouTube4,YouTube,2020,Better protecting kids’ privacy on YouTube,https://blog.youtube/news-and-events/better-protecting-kids-privacy-on-youtube/,ChildrenUnder13,General Creators & Platform,General Creators & Platform,Audience Age Settings,Content Exposure,AUDIENCE_SETTING,,,,,"To help us identify made for kids content, in November we introduced a new audience setting in YouTube Studio to help creators indicate whether or not their content is made for kids. Creators know their content best, and should set the designation themselves. We also use machine learning to help us identify this content, and creators can update a designation made by our systems if they believe it is incorrect. We will only override a creator designation if abuse or error is detected."
Snapchat1,Snapchat,2020,Rewarding Creativity on Spotlight: Shining a Light on the Best Snaps,https://newsroom.snap.com/rewarding-creativity,ChildrenUnder16,Platform,Platform,Monetization Restrictions,Monetization,,,,"MINIMUM_AGE_16_TO_EARN, PARENTAL_CONSENT_TO_EARN",," Snapchatters must be 16 or older and, where applicable, obtain parental consent to earn."
Snapchat2,Snapchat,2020,Introducing Spotlight on Snapchat,https://newsroom.snap.com/introducing-spotlight,ChildrenUnder16,Platform,Platform,Monetization Restrictions,Monetization,,,,MINIMUM_AGE_16_TO_EARN,,"For the opportunity to earn money, the Snaps you submit to Spotlight must follow our content guidelines and Terms. You must be 16 or older to earn."
YouTube46,YouTube,2022,Upload art tracks as made for kids,https://support.google.com/youtube/answer/9609276?hl=en,ChildrenUnder13,General Creators & Platform,General Creators & Platform,Audience Age Settings,Content Exposure,AUDIENCE_SETTING,,,,,"As a YouTube creator, you are required to set future and existing videos as made for kids or not. Even creators who don’t make content for kids need to set their audience. This will help ensure that we offer the appropriate features on your content. 

To help you comply, we are introducing a new audience setting on YouTube Studio. You can set your audience:

At the channel level, which will set all of your future and existing content as made for kids or not. 
Or, at the video level. If you choose this option, you’ll need to set each existing and future video as made for kids or not. "
Snapchat36,Snapchat,2024,Crystals FAQ,https://help.snapchat.com/hc/en-us/articles/5909152630420-Crystals-FAQ,Teens (13-15),Platform,Platform,Monetization Restrictions,Monetization,,,,NO_RECEIVING_PAYMENT,,"To be eligible to receive payments, you must have reached the legal age of majority in your jurisdiction or be at least 16 years old with the consent of your parent(s)/legal guardian(s)."
Snapchat4,Snapchat,2021,Challenge Accepted: Announcing A New Way to Win Money on Spotlight,https://newsroom.snap.com/spotlight-challenges,ChildrenUnder16,Platform,Platform,Monetization Restrictions,Monetization,,,,MINIMUM_AGE_16_TO_EARN,,Spotlight Challenges will be rolling out next month to Snapchatters 16+ in the U.S.
