Meta1,Meta,2024,Tips for Parents,https://help.instagram.com/154475974694511/?helpref=search&query=teen&search_session_id=a2bf3bf8ea1c5debe7fbc0da7bd42645&sr=11,Teens (13-17),Platform,Platform,Data Privacy Controls,Data Access,,,,"NO_ACCOUNT_ACCESS, NO_MESSAGE_ACCESS, 
NO_PASSWORD_ACCESS, 
NO_ACCOUNT_DELETION, NO_SEARCH_HISTORY, NO_POST",,"We appreciate your concern for your teen’s use of our app, but we generally can't give you access to the account or take any action on the account at your request. We're generally forbidden by privacy laws against giving unauthorized access to someone who isn't an account holder. Users ages 13 and older are considered authorized account holders and are included in the scope of this policy.

Even if supervision is set up, you still own your Instagram account. Your parent won’t be able to see your messages, change your password or, in most cases, delete your account.
Even if supervision is set up, you still own your Instagram account. Your parent won’t be able to see your messages, change your password or, in most cases, delete your account.
Even if supervision is set up, you still own your Instagram account. Your parent won’t be able to see your messages, change your password or, in most cases, delete your account.

""With supervision, a parent or guardian won’t be able to:
See their teen’s search history or chats (only accounts who your teen has chats with)
Post for them"""
Meta18_1,Meta,2024,Instagram Teen Accounts,https://about.instagram.com/community/teen-accounts,Teens (13-17),Platform,Platform,Data Privacy Controls,Data Access,,,CHANGE_PRIVATE_ACCOUNT,,,Teen Accounts are automatically set to private. Teens under 16 can only change this default setting with help from a parent or guardian. Learn how to set up supervision on Instagram.
Meta18_1,Meta,2024,Instagram Teen Accounts,https://about.instagram.com/community/teen-accounts,Teens (13-17),Platform,Platform,Data Privacy Controls,Data Access,,,DEFUALT_PRIVATE_ACCOUNT,,,Teen Accounts are automatically set to private. Teens under 16 can only change this default setting with help from a parent or guardian. Learn how to set up supervision on Instagram.
Meta2,Meta,2024,Accessing a teen's Instagram account,https://help.instagram.com/359897877431452/?helpref=search&query=teen&search_session_id=a2bf3bf8ea1c5debe7fbc0da7bd42645&sr=19,Teens (13-17),Platform,Platform,Data Privacy Controls,Data Access,,,,NO_ACCOUNT_ACCESS,,"We appreciate your concern for your teen’s use of our app, but we generally can't give you access to the account or take any action on the account at your request. We're generally forbidden by privacy laws against giving unauthorized access to someone who isn't an account holder. Users ages 13 and older are considered authorized account holders and are included in the scope of this policy."
Meta3,Meta,2024,Deleting a teen‘s Instagram account,https://help.instagram.com/111341082356174/?helpref=search&query=teen&search_session_id=a2bf3bf8ea1c5debe7fbc0da7bd42645&sr=23,Teens (13-17),Platform,Platform,Data Privacy Controls,Data Access,,,,NO_ACCOUNT_DELETION,,"Teens can always delete their own account from Instagram. In most regions, neither parents nor Instagram can delete a teen’s account.
"
Meta32,Meta,2021,Asking People for Their Birthdays,https://about.instagram.com/blog/announcements/asking-people-for-their-birthdays,Teens (13-17),Platform,Platform,Data Privacy Controls,Data Access,,,PRIVATE_ACCOUNT,,,and last month we started to default new accounts belonging to people under the age of 16 into a private setting.
Meta34,Meta,2021,"Giving Young People a Safer, More Private Experience",https://about.instagram.com/blog/announcements/giving-young-people-a-safer-more-private-experience,Teens (13-17),Platform,Platform,Data Privacy Controls,Data Access,,,PRIVATE_ACCOUNT,,,"Defaulting people under 16 into private accounts
Wherever we can, we want to stop young people from hearing from adults they don’t know, or that they don’t want to hear from. We believe private accounts are the best way to prevent this from happening. So starting this week, everyone who is under 16 years old (or under 18 in certain countries) will be defaulted into a private account when they join Instagram.

Private accounts let people control who sees or responds to their content. If you have a private account, people have to follow you to see your posts, Stories and Reels unless you choose to allow others to reshare your content. People also can’t comment on your content in those places, and they won’t see your content at all in places like Explore or hashtags."
Meta34,Meta,2021,"Giving Young People a Safer, More Private Experience",https://about.instagram.com/blog/announcements/giving-young-people-a-safer-more-private-experience,Teens (13-17),Platform,Platform,Data Privacy Controls,Data Access,,,,,NO_SHOWING_TEENS,"Stopping unwanted contact
Encouraging young people to have private accounts is a big step in the right direction when it comes to stopping unwanted contact from adults. But we’re going even further to make young people’s accounts difficult to find for certain adults.

We’ve developed new technology that will allow us to find accounts that have shown potentially suspicious behavior and stop those accounts from interacting with young people’s accounts. By “potentially suspicious behavior”, we mean accounts belonging to adults that may have recently been blocked or reported by a young person for example.

Using this technology, now we won’t show young people’s accounts in Explore, Reels or ‘Accounts Suggested For You’ to these adults. If they find young people’s accounts by searching for their usernames, they won’t be able to follow them. They also won’t be able to see comments from young people on other people’s posts, nor will they be able to leave comments on young people’s posts. We’ll continue to look for additional places where we can apply this technology."
Meta34,Meta,2021,"Giving Young People a Safer, More Private Experience",https://about.instagram.com/blog/announcements/giving-young-people-a-safer-more-private-experience,Teens (13-17),Platform/Parents,Platform & Parents,Ads Personalization Settings,Monetization,,,,ADS_SETTINGS,,"We already give people ways to tell us that they would rather not see ads based on their interests or on their activities on other websites and apps, such as through controls within our ad settings. But we’ve heard from youth advocates that young people may not be well equipped to make these decisions. We agree with them, which is why we’re taking a more precautionary approach in how advertisers can reach young people with ads."
Meta53,Meta,2024,Parental Supervision,https://help.instagram.com/309877544512275/?helpref=search&query=teen&search_session_id=a2bf3bf8ea1c5debe7fbc0da7bd42645&sr=29,Teens (13-17),Parents/Teens,Parents & Teens,Data Privacy Controls,Data Access,,,,PRIVACY_SETTING,,"Their teen’s account privacy setting.
Their teen’s setting for who can send them message requests.
Their teen’s setting for who can add them to a group chat.
Their teen’s sensitive content setting.
Their teen’s settings for who can tag or mention them or remix their content.
Their teen’s sensitive content setting.
Their teen’s Hidden Words settings, which hide potentially offensive comments and message requests. Note: This setting for message requests is not currently supported on web browsers or Meta Quest.
Their teen’s sleep mode setting.
Their teen’s daily time limit."
Meta7,Meta,2024,Visibility of your teen's images on Instagram,https://help.instagram.com/514520825226629/?helpref=search&query=teen&search_session_id=a2bf3bf8ea1c5debe7fbc0da7bd42645&sr=10,Teens (13-15),Platform,Platform,Data Privacy Controls,Data Access,,,PRIVATE_ACCOUNT,,,"If you are under 16 when you sign up for an Instagram account, you’ll have the option to choose between a public or private account, but Private is selected by default."
Meta75,Meta,2024,About Instagram Teen Accounts,https://help.instagram.com/995996839195964/?helpref=search&query=teen&search_session_id=a2bf3bf8ea1c5debe7fbc0da7bd42645&sr=6,Teens (13-17),Platform,Platform,Data Privacy Controls,Data Access,,,PRIVATE_ACCOUNT,,,"New accounts: When teens 13-17 sign up for a new Instagram account, they will be defaulted to private accounts. Teens under 16 will need their parent’s or guardian’s permission to switch their accounts to public. Teens 16-17 can change their accounts to public without permission, unless they have set up supervision with their parent or guardian.
Existing accounts: With the introduction of Teen Accounts, existing accounts for teens under 16 will be set to private, even if their accounts were previously public. They will need their parent’s or guardian’s permission to change their accounts to public. Teens 16-17 with existing public accounts will not be automatically set to private accounts, and they can keep their accounts public without permission."
Meta76,Meta,2024,About Instagram teen privacy and safety settings,https://help.instagram.com/3237561506542117/?helpref=search&query=teen&search_session_id=a2bf3bf8ea1c5debe7fbc0da7bd42645&sr=2,Teens (13-17),Platform,Platform,Data Privacy Controls,Data Access,,,PRIVATE_ACCOUNT,,,"Private Accounts
Teens under 18 years old have their account set to private as a default when they join Instagram. Private accounts let people control who sees or responds to their content. Learn more about private Instagram accounts."
Meta90,Meta,2024,How Meta products and tools support age-appropriate experiences,https://about.meta.com/actions/safety/resource/f/871648470589685/,Teens (13-17),Platform,Platform,Data Privacy Controls,Data Access,,,,,,"Privacy settings for teens
by default
When they first join Instagram and
Facebook, teens 16 and under (or 18
in certain countries) are defaulted
into private accounts and other more
private settings."
Snapchat11,Snapchat,2024,New Features to Help Protect Our Community,https://values.snap.com/news/new-features-to-help-protect-our-community?lang=en-US,Teens (13-17),Platform,Platform,Data Privacy Controls,Data Access,,"NO_PUBLIC_FRIEND_LIST, LOCATION_SHARING_ONLY_WITH_FRIENDS",,,,"We have never offered public friend lists. We send all Snapchatters – including teens – regular reminders to check their account security and privacy settings, and only allow Snapchatters to share their location with friends."
Snapchat13,Snapchat,2024,"Snapchat offers older teens 16+ an introduction to responsible public sharing with enhanced safeguards, education, and new parental tools",https://values.snap.com/news/public-profiles-16-17?lang=en-US,Teens (16-17),Platform/Teen,Platform & Teens,Data Privacy Controls,Data Access,,,,,"PUBLIC_STORY_POSSIBLE, PUBLIC_SPOTLIGHT_POSSIBLE, PUBLIC_CONTENT_RECOMMENDATION_ONLY_TO_FOLLOWERS_AND_MUTUAL_FRIENDS, NO_VISIBILITY_OF_NUMBER_OF_FAVORITES_ON_CONTENT","Designed for engagement from real friends: By default, all Snapchatters can only communicate directly with their mutually accepted friends or contacts saved in their phone. With public-posting options, older teens are able to receive Story replies on their public Stories from those who follow them, but cannot engage in direct chat conversations from those replies. Replies are filtered before they reach the creator – and that filtering is even stricter for Snapchatters ages 16 and 17. Snapchatters even have the option to turn off replies all together, or to block various terms to help them keep interactions respectful and fun. These Story replies from those who follow them are kept completely separate from Snapchatters' private conversations in their chat feed, and we have additional protections to help prevent content shared publicly from being a vector for unwanted friend requests from adults outside of a teens real friend network.  Limited distribution: Public Stories from 16- and 17-year olds will only be recommended to Snapchatters who are already their friends or followers, and to other Snapchatters with whom they share mutual friends. These public Stories are not distributed to the wider community in “Discover,” the section of our app where Snapchatters find a personalized viewing experience with content that’s relevant for them. Minimal metrics: Snapchatters ages 16 - 17 will not see how many people “favorited” their Stories or Spotlights, keeping the focus on creativity over pressure to collect public approval metrics. "
Snapchat14,Snapchat,2024,SPS 2024 | New Ways for Creators to Build a Community & Find Success,https://newsroom.snap.com/sps-2024-new-ways-for-creators,Teens (16-17),Platform/Teen,Platform & Teens,Data Privacy Controls,Data Access,,EASY_TOGGLE_BETWEEN_PRIVATE_AND_PUBLIC_CONTENT,,,,"A new simplified profile design allows Snapchatters 16 and older to easily toggle between their personal and public accounts. If they want to connect with their real friends – personal. And if they choose to reach a wider audience – public. For Snapchatters aged 16 and 17, the highest privacy safety settings are on by default. "
Snapchat14,Snapchat,2024,SPS 2024 | New Ways for Creators to Build a Community & Find Success,https://newsroom.snap.com/sps-2024-new-ways-for-creators,Teens (16-17),Platform/Teen,Platform & Teens,Data Privacy Controls,Data Access,,,,HIGHEST_PRIVACY_SETTINGS,,
Snapchat17,Snapchat,2024,Snapchat Brings Location Sharing to Family Center,https://newsroom.snap.com/new-location-sharing-features-family-center,Teens (13-17),Platform/Teen,Platform & Teens,Data Privacy Controls,Data Access,,"DEFAULT_NO_LOCATION_SHARING, NO_LOCATION_SHARING_WITH_NON-FRIENDS",REMINDERS_TO_REVIEW_LOCATION_SHARING_SETTINGS,,,"On Snapchat, location sharing is always off by default, and there is no option to ever share location with someone who is not an accepted friend. For people who do share their location with all of their Snapchat friends, we’re adding new in-app reminders to review their selections. Snapchatters will see a pop up when they add a new friend who may be outside their real world network, prompting them to be extra thoughtful about their settings. "
Snapchat19,Snapchat,2024,How do I make a privacy request for my teen?,https://help.snapchat.com/hc/en-us/articles/28013038693908-How-do-I-make-a-privacy-request-for-my-teen,Teens (13-17),Parents/Teen,Parents & Teens,Data Privacy Controls,Data Access,,,,"REQUEST_TO_ACCESS_OWN_INFORMATION, REQUEST_TO_DOWNLOAD_OWN_INFORMATION, REQUEST_TO_DELETE_OWN_INFORMATION, PARENTAL_REQUEST_TO_ACCESS_TEENS_INFORMATION, PARENTAL_REQUEST_TO_DOWNLOAD_TEENS_INFORMATION, PARENTAL_REQUEST_TO_DELETE_TEENS_INFORMATION",,"Depending on the state in which the Snapchatter resides, parents and legal guardians of Snapchatters ages 13-17 may submit privacy requests on their teen’s behalf. These requests may include options to access, download, and delete your teen’s information, including the deletion of their Snapchat account. Your teen can also exercise the same privacy rights."
Snapchat26,Snapchat,2025,How do I get visibility into my teen’s location through Family Center?,https://help.snapchat.com/hc/en-us/articles/32758431822868-How-do-I-get-visibility-into-my-teen-s-location-through-Family-Center,Teens (13-17),Parents,Parents,Data Privacy Controls,Data Access,,PARENTAL_REQUEST_TO_SEE_TEENS_LOCATION,,,,"In Family Center, you can send a request to your teen asking them to share their live location."
Snapchat3,Snapchat,2021,Introducing Friend Check Up,https://newsroom.snap.com/introducing-friend-check-up,Teens (13-17),Platform,Platform,Data Privacy Controls,Data Access,,,,,NO_BROWSABLE_PUBLIC_PROFILES,There are no browsable public profiles for Snapchatters under 18
Snapchat32,Snapchat,N/A,How is posting publicly for 16-17 year olds different than posting publicly for 18+?,https://help.snapchat.com/hc/en-us/articles/30741509382420-How-is-posting-publicly-for-16-17-year-olds-different-than-posting-publicly-for-18,Teens (16-17),Platform,Platform,Data Privacy Controls,Data Access,,"NO_PUBLIC_POST_TO_SNAP_MAP, ONLY_STORY_REPLIES_FROM_FOLLOWERS, ONLY_CHATS_WITH_REPLIERS_THAT_ARE_FRIENDS","PUBLIC_PROFILE_PHOTO, PUBLIC_COVER_PHOTO, PUBLIC_BIO, ADD_SNAPS_TO_PUBLIC_PAGE, POST_PUBLIC_STORY, POST_PUBLIC_SPOTLIGHT, VIEW_STORY_REPLIES_AND_COMMENTS, QUOTE_STORY_REPLIES_AND_COMMENTS, VIEW_PUBLIC_STORIES_ANALYTICS, VIEW_PUBLIC_SPLOTLIGHT_ANALYTICS, DEFAULT_NO_PUBLIC_SPOTLIGHT",HIGHEST_PRIVACY_SETTINGS,NO_REMIXING_OF_THEIR_CONTENT,"16-17 year olds will be able to do the following, all while maintaining the highest privacy settings by default: Add a profile photo, cover photo, and bio to the publicly viewable content page within their profile
Add or save Snaps to this publicly viewable page within their profile
Post videos to Spotlight with their username shown
Post to a public Story
View and quote Story replies and comments
View analytics about their public Stories and Spotlights"
Snapchat35,Snapchat,2023,About Profiles on Snapchat,https://help.snapchat.com/hc/en-us/articles/7012292808596-About-Profiles-on-Snapchat,Teens (13-15),Platform,Platform,Data Privacy Controls,Data Access,,NO_PUBLIC_PROFILE,,,,Public Profiles enable Snapchatters ages 16 and older in certain countries to share their creativity publicly and grow an audience on Snapchat. 
Snapchat7,Snapchat,2023,SPS 2023: New Programs and Features for Creators,https://newsroom.snap.com/sps-2023-new-programs-and-features-for-creators,Teens (13-17),Platform,Platform,Data Privacy Controls,Data Access,,NO_PUBLIC_STORIES,,,NO_PUBLIC_STORIES,"Starting today, Snapchatters aged 18 or older will be able to post their own Public Story with a simple tap. Open the camera, create a Snap, and choose to share it with friends or add it to your Public Story, all from the same account."
Snapchat8,Snapchat,2023,New features and transparency measures to comply with the EU's Digital Services Act,https://newsroom.snap.com/digital-services-act-snap,Teens (13-17),Platform,Platform,Ads Personalization Settings,Monetization,,,,LESS_ADS_PERSONALIZATION_OPTIONS,,"Restricting personalised advertising for Snapchatters aged 13 - 17 in the EU and UK - Most targeting and optimisation tools will no longer be available for advertisers to personalise ads for Snapchatters in the EU and UK under the age of 18. Now, personalisation of ads to these Snapchatters will be limited to basic essential information, like language settings, age and location."
Snapchat8_2,Snapchat,2023,Updating our Advertising in Europe and the UK,https://values.snap.com/news/updating-our-advertising-in-europe-and-uk-2023?lang=en-GB,Teens (13-17),Platform,Platform,Ads Personalization Settings,Monetization,,,,LESS_ADS_PERSONALIZATION_OPTIONS,,"we will be implementing changes to the way we show ads to Snapchatters under the age of 18 in the EU and UK. As a result, most targeting and optimisation tools for advertisers will no longer be available for personalising ads to these teen Snapchatters."
Snapchat8_2_1,Snapchat,2022,Introducing Family Centre on Snapchat,https://values.snap.com/news/introducing-family-center-on-snapchat?lang=en-GB,Teens (13-17),Platform,Platform,Data Privacy Controls,Data Access,,"DEFAULT_MESSAGING_WITH_FRIENDS_ONLY, PRIVATE_FRIENDS_LISTS, _NO_PUBLIC_PROFILES, LIMITED_DISCOVERABILITY_IN_SEARCH, LIMITED_PROFILE_SUGGESTING",,,,"By default, teens have to be mutual friends before they can start communicating with each other. Friend lists are private, and we don't allow teens to have public profiles."
Snapchat8_2_1_1,Snapchat,2024,Parent's Guide: Snapchat's Family Center,https://assets.ctfassets.net/gqgsr8avay9x/53kgZIyFD6i4TbPpgzK5r2/4e679d035e89ebda2ab1b47e1c9f1428/20220728_SNAP_FamilyCenter_ParentsGuide.pdf?lang=en-GB,Teens (13-17),Platform,Platform,Data Privacy Controls,Data Access,,"DEFAULT_MESSAGING_WITH_FRIENDS_ONLY, PRIVATE_FRIENDS_LISTS, _NO_PUBLIC_PROFILES, LIMITED_DISCOVERABILITY_IN_SEARCH, LIMITED_PROFILE_SUGGESTING",,,,"We require teens to mutually accept each other as friends in order to begin communicating. By default, Snapchatters under 18 must opt-in to being friends in order to start chatting with each other.
We ban public profiles for minors and friend lists are private. We intentionally make it harder for strangers to find minors by banning public profiles for people under 18, and for all Snapchatters, friend lists are private.
We limit discoverability for teens to people they likely know. Teens only show up as a ""suggested friend"" or in search results in limited instances, like if they have mutual friends in common. "
TikTok1,TikTok,2019,musical.ly’s agreement with FTC,https://newsroom.tiktok.com/en-us/musical-lys-agreement-with-ftc ,ChildrenUnder13,Platform,Platform,Data Privacy Controls,Data Access,,"PERSONAL_VIDEO_SHARING_RESTRICTIONS, INFORMATION_SHARING_SUSPENSION",,NO_PROFILE,,The new environment for younger users does not permit the sharing of personal information
TikTok14,TikTok,2020,Supporting youth and families on TikTok,https://newsroom.tiktok.com/en-us/supporting-youth-and-families-on-tiktok,ChildrenUnder13,Platform,Platform,Data Privacy Controls,Data Access,,,"VIEW_ONLY, NO_POSTING_CONTENT",NO_PROFILE,,"In the US, we accommodate those under the age of 13 in TikTok for Younger Users, a view-only experience with curated content and additional safety and privacy protections designed specifically for an under-13 audience. In this ecosystem, users can experience and make fun, creative, and even educational videos but cannot post those videos, comment on others' videos, message with others, or maintain a profile or followers."
TikTok17,TikTok,2021,Strengthening privacy and safety for youth on TikTok,https://newsroom.tiktok.com/en-us/strengthening-privacy-and-safety-for-youth,Teens (13-15),Platform,Platform,Data Privacy Controls,Data Access,,"VIDEOS_VISIBLE_ONLY_FOR_FOLLOWERS, NO_COMMENTING_FOR_EVERYONE_SETTING, COMMENT_ONLY_FOR_FRIENDS_OR_NOONE, DEFAULT_NO_PROFILE_SUGGESTIONS_TO_OTHERS, DEFAULT_NO_ACCOUNT_SUGGESTION",,DEFAULT_PRIVATE_PROFILE,,"With a private TikTok account, only someone who the user approves as a follower can view their videos. Tightening the options for commenting on videos created by those ages 13-15. These users can now choose between Friends or No One for their account; the Everyone comment setting is being removed. Setting ""Suggest your account to others"" to Off by default for users ages 13-15."
TikTok21,TikTok,2021,Our work to design an age-appropriate experience on TikTok,https://newsroom.tiktok.com/en-us/our-work-to-design-an-age-appropriate-experience-on-tiktok,ChildrenUnder13,Platform,Platform,Data Privacy Controls,Data Access,,,NO_POSTING_CONTENT,"NO_PROFILE, MINIMUM_AGE_12, SUSPENDING_SUSPECTED_UNDERAGE_ACCOUNTS",,"TikTok has a 12+ rating in the App Store which lets parents use device-level parental controls to block their teen from downloading the app. In the US, if someone enters a birthday that confirms they're under 13, they'll be directed into TikTok for Younger Users, a curated viewing experience with additional safeguards and privacy protections designed specifically for this audience.  When our safety team believes that an account may belong to an underage person, the account will be suspended."
TikTok21,TikTok,2021,Our work to design an age-appropriate experience on TikTok,https://newsroom.tiktok.com/en-us/our-work-to-design-an-age-appropriate-experience-on-tiktok,Teens (13-15),Platform,Platform,Data Privacy Controls,Data Access,,DEFAULT_PRIVATE_ACCOUNT,,,,automatically set accounts of users ages 13-15 to private by default.
TikTok25,TikTok,2021,Furthering our safety and privacy commitments for teens on TikTok,https://newsroom.tiktok.com/en-us/furthering-our-safety-and-privacy-commitments-for-teens-on-tiktok-us,Teens (13-15),Platform,Platform,Data Privacy Controls,Data Access,,"DEFAULT_PRIVATE_ACCOUNT, NO_SHARING_CONTENT_WITH_EVERYONE, POP_UP_QUESTION_WHO_CAN_WATCH_THEIR_VIDEOS, NO_DOWNLOADING_OF_THEIR_VIDEOS",,,,"Accounts aged 13-15 are set to private by default, and private accounts can choose to share their content with Followers or Friends, as the 'Everyone' setting is turned off. "
TikTok3,TikTok,2019,TikTok's Top 10 Tips for Parents,https://newsroom.tiktok.com/en-us/tiktoks-top-10-tips-for-parents,Teens (13-17),Parent/Teen,Parents & Teens,Data Privacy Controls,Data Access,,"PRIVATE_ACCOUNT, CONTROL_OVER_FOLLOWER_REQUESTS, CONTENT_VISIBLE_FOR_FOLLOWERS_ONLY, BLOCKING_USERS, NO_CHATTING_FOR_NON-FOLLOWERS, CONTROL_COMMENT_SETTINGS",,,,"By default, a TikTok account starts as public – but you can easily enable a private account in the privacy and safety settings. A private account means you can approve or deny follower requests, and only users you’ve approved as followers can see your content. Learn more about enabling a private account here."
TikTok30,TikTok,2022,Marking Data Privacy Day,https://newsroom.tiktok.com/en-us/marking-data-privacy-day,ChildrenUnder16,Platform,Platform,Data Privacy Controls,Data Access,,DEFAULT_PRIVATE_ACCOUNT,,,,Made an industry leading change to set accounts under age 16 to private by default
TikTok30,TikTok,2022,Marking Data Privacy Day,https://newsroom.tiktok.com/en-us/marking-data-privacy-day,Teens (16-17),Platform,Platform,Data Privacy Controls,Data Access,,DEFAULT_NO_DIRECT_MESSAGING,,,,Rolled out additional protective measures for teens including changing default DM settings for 16 and 17 year olds to ‘No One’
TikTok4,TikTok,2019,TikTok Parental Guide,https://newsroom.tiktok.com/en-us/tiktok-parental-guide,Teens (13-17),Platform/Teen,Platform & Teens,Data Privacy Controls,Data Access,,"PRIVATE_ACCOUNT, CONTROL_OVER_FOLLOWER_REQUESTS, CONTENT_VISIBLE_FOR_FOLLOWERS_ONLY",,,,"If you switch to a private account you can approve or deny follower requests, and only users you’ve approved as followers can see your content."
