Snapchat28,Snapchat,2023,What is Family Center?,https://help.snapchat.com/hc/en-us/articles/7121384944788-What-is-Family-Center,Teens (13-17),Parents,Parents,Reporting User,Interpersonal Communication,,"DISABLE_MY_AI, PARENTAL_REPORTING_OF_ABUSERS",,,,"See which Snapchat friends or Groups their teens have chatted with in the last seven days, in a way that still protects their privacy by not revealing the actual contents of their conversations (Snaps and messages); See a complete list of Group members in Group chats their teen is in that have been active over the last seven days; See a complete list of their teens’ existing friends and easily view new friends their teens have added, making it easy to start conversations about who their new contacts are; Limit their teen’s ability to view certain content in the Stories and Spotlight tabs; Disable My AI from responding to their teen; View their teen's birthday settings; and Easily and confidentially report any accounts parents may be concerned about directly to our 24/7 Trust and Safety team."
Snapchat30,Snapchat,2023,How We Keep Our Snapchat Community Safe & Informed,https://help.snapchat.com/hc/en-us/articles/7012398850836-How-We-Keep-Our-Snapchat-Community-Safe-Informed,Teens (13-17),Parents (25+),Parents,Reporting User,Interpersonal Communication,,PARENTAL_REPORTING_OF_ABUSERS,,"PARENTS_SEE_TEENS_FRIENDS, PARENTS_SEE_WHO_TEENS_MESSAGED",,"If you’re a parent over the age of 25, you can use Family Center to get more insight into who your teen is friends with on Snapchat, and who they have been communicating with, while still respecting their teens’ privacy and autonomy. Easily and confidentially report any accounts parents may be concerned about directly to our 24/7 Trust and Safety team"
Snapchat21,Snapchat,2024,How do I restrict content for my teen in Family Center?,https://help.snapchat.com/hc/en-us/articles/13904198624276-How-do-I-restrict-content-for-my-teen-in-Family-Center,Teens (13-17),Parents,Parents,Content Recommendation Restrictions,Content Exposure,PARENTAL_CONTROL_TO_RESTRICT_SENSITIVE_CONTENT,,,,,"As a parent enrolled in Family Center, you can restrict certain content that your teen may see in the Stories and Spotlight tabs. While Stories and Spotlight content is moderated, some posts may contain images or captions that do not explicitly violate our Community Guidelines yet contain sensitive or suggestive content - for example, references to sexual activity or visual emphasis on certain body parts. Note that this does not restrict your teen from viewing this content in other places, for example when viewed as part of search results, as shared in Chat, or as part of a Subscription."
Snapchat31,Snapchat,2024,How do I stay safe on Snapchat?,https://help.snapchat.com/hc/en-us/articles/7012304746644-How-do-I-stay-safe-on-Snapchat,Teens (13-17),Parents (25+),Parents,Reporting User,Interpersonal Communication,,PARENTAL_REPORTING_OF_ABUSERS,,,,"Family Center will provide parents over the age of 25 the ability to: See which Snapchat friends their teens have sent messages, photos, or videos to in the last seven days, in a way that still protects their privacy by not revealing the actual contents of their conversations (Snaps and messages); See a complete list of their teens’ existing friends, and allow parents to easily view new friends their teens have added, making it easy to start conversations about who their new contacts are; Limit their teen’s ability to view certain content in the Stories and Spotlight tabs; and Easily and confidentially report any accounts parents may be concerned about directly to our 24/7 Trust and Safety team."
Snapchat27,Snapchat,2024,What if my teen sees any content that could be sensitive or suggestive in Stories and Spotlight after I’ve turned on content controls?,https://help.snapchat.com/hc/en-us/articles/13904201635476-What-if-my-teen-sees-any-content-that-could-be-sensitive-or-suggestive-in-Stories-and-Spotlight-after-I-ve-turned-on-content-controls,Teens (13-17),Parents,Parents,Content Recommendation Restrictions,Content Exposure,PARENTAL_CONTROL_TO_RESTRICT_SENSITIVE_CONTENT,,,,,"To reduce instances of sensitive or suggestive content appearing on your teen’s Stories and Spotlight feeds, you can turn on restrictions in Family Center."
Snapchat28,Snapchat,2023,What is Family Center?,https://help.snapchat.com/hc/en-us/articles/7121384944788-What-is-Family-Center,Teens (13-17),Parents,Parents,Content Viewing Levels,Content Exposure,PARENTAL_CONTROL_TO_RESTRICT_SENSITIVE_CONTENT,,,,,"See which Snapchat friends or Groups their teens have chatted with in the last seven days, in a way that still protects their privacy by not revealing the actual contents of their conversations (Snaps and messages); See a complete list of Group members in Group chats their teen is in that have been active over the last seven days; See a complete list of their teens’ existing friends and easily view new friends their teens have added, making it easy to start conversations about who their new contacts are; Limit their teen’s ability to view certain content in the Stories and Spotlight tabs; Disable My AI from responding to their teen; View their teen's birthday settings; and Easily and confidentially report any accounts parents may be concerned about directly to our 24/7 Trust and Safety team."
Snapchat31,Snapchat,2024,How do I stay safe on Snapchat?,https://help.snapchat.com/hc/en-us/articles/7012304746644-How-do-I-stay-safe-on-Snapchat,Teens (13-17),Parents (25+),Parents,Content Viewing Levels,Content Exposure,PARENTAL_CONTROL_TO_RESTRICT_SENSITIVE_CONTENT,,,,,"Family Center will provide parents over the age of 25 the ability to: See which Snapchat friends their teens have sent messages, photos, or videos to in the last seven days, in a way that still protects their privacy by not revealing the actual contents of their conversations (Snaps and messages); See a complete list of their teens’ existing friends, and allow parents to easily view new friends their teens have added, making it easy to start conversations about who their new contacts are; Limit their teen’s ability to view certain content in the Stories and Spotlight tabs; and Easily and confidentially report any accounts parents may be concerned about directly to our 24/7 Trust and Safety team."
Snapchat8_1,Snapchat,2024,Content Guidelines for Recommendation Eligibility,"https://www.snap.com/content-recommendation-guidelines?lang=en-GB#:~:text=harassment%20or%20bullying.-,Disturbing%20or%20Violent%20Content,graphic%20violence%2C%20including%20animal%20abuse.",Teens (13-17),Platform,Platform,Content Recommendation Restrictions,Content Exposure,,,,,NO_RECOMMENDATION,"Our Community Guidelines strictly prohibit all forms of child sexual exploitation. These Content Guidelines additionally prohibit edge-case content that may fall short of a legal definition of child sexual exploitation or abuse material. That means we deny amplification to any content, real or fictional, about romantic or sexual relationships between adults and minors, unless the specific incident is newsworthy because of its relevance to prominent issues, individuals or institutions. Even in newsworthy instances, coverage of minors in sexual situations must not be sensationalized, suggestive or exploitative. This also includes content, real or fictional, about sexual activity between minors."
TikTok1,TikTok,2019,musical.ly’s agreement with FTC,https://newsroom.tiktok.com/en-us/musical-lys-agreement-with-ftc ,ChildrenUnder13,Platform,Platform,Content Recommendation Restrictions,Content Exposure,CONTENT_RESTRICTIONS,,,,,The new environment for younger users puts extensive limitations on content 
TikTok12,TikTok,2020,Coming together to support body positivity on TikTok,https://newsroom.tiktok.com/en-us/coming-together-to-support-body-positivity-on-tiktok,Teens (13-17),Platform,Platform,Content Viewing Levels,Content Exposure,ADS_AGE_RESTRICTIONS,,,,,Weight management products can only reach users age 18+
TikTok14,TikTok,2020,Supporting youth and families on TikTok,https://newsroom.tiktok.com/en-us/supporting-youth-and-families-on-tiktok,Teens (13-17),Platform,Platform,Content Recommendation Restrictions,Content Exposure,,,,,CONTENT_REMOVAL,"We've also developed global partnerships to protect against child exploitation as we remove such content, terminate accounts, and report cases the National Center for Missing and Exploited Children and law enforcement."
TikTok14,TikTok,2020,Supporting youth and families on TikTok,https://newsroom.tiktok.com/en-us/supporting-youth-and-families-on-tiktok,Teens (13-17),Platform,Platform,Account Termination,Content Creation,,,,,"TERMINATING_ACCOUNTS, REPORTING_CASES, PHOTO_IDENTIFICATION","We've also developed global partnerships to protect against child exploitation as we remove such content, terminate accounts, and report cases the National Center for Missing and Exploited Children and law enforcement."
TikTok14,TikTok,2020,Supporting youth and families on TikTok,https://newsroom.tiktok.com/en-us/supporting-youth-and-families-on-tiktok,Teens (13-17),Parent,Parents,Content Viewing Levels,Content Exposure,CONTENT_RESTRICTIONS,,,,,
TikTok17,TikTok,2021,Strengthening privacy and safety for youth on TikTok,https://newsroom.tiktok.com/en-us/strengthening-privacy-and-safety-for-youth,ChildrenUnder13,Platform,Platform,Content Recommendation Restrictions,Content Exposure,RESTRICTED_CONTENT,,,,,"In the US, we accommodate users under 13 in a limited app experience, TikTok for Younger Users, which offers additional safeguards and privacy protections designed specifically for a younger audience. This experience allows users to browse a curated library of age-appropriate videos"
TikTok19,TikTok,2021,TikTok joins the Technology Coalition,https://newsroom.tiktok.com/en-us/us-tiktok-joins-the-technology-coalition,Teens (13-17),Platform,Platform,Content Recommendation Restrictions,Content Exposure,,,,,"CONTENT_REMOVAL, TERMINATING_ACCOUNTS, REPORTING_CASES","We do not tolerate content or behavior that perpetuates the abuse, harm, endangerment, or exploitation of minors, as outlined in our Community Guidelines. If we become aware of any such content, we will take immediate action to remove content, terminate accounts, and report cases to NCMEC and law enforcement, as appropriate."
TikTok2,TikTok,2019,Limiting unwanted content,https://newsroom.tiktok.com/en-us/limiting-unwanted-content,Teens (13-17),"Parent/Teen (only the one who enabled it, can disable it)",Parents & Teens,Content Viewing Levels,Content Exposure,CONTENT_RESTRICTIONS,,,,,"If you’re a parent and your teen uses TikTok, it might make sense to enable this setting to ensure the content they are viewing is age-appropriate."
TikTok21,TikTok,2021,Our work to design an age-appropriate experience on TikTok,https://newsroom.tiktok.com/en-us/our-work-to-design-an-age-appropriate-experience-on-tiktok,ChildrenUnder13,Platform,Platform,Content Recommendation Restrictions,Content Exposure,"VIEW_ONLY, RESTRICTED_CONTENT",,,,,"TikTok has a 12+ rating in the App Store which lets parents use device-level parental controls to block their teen from downloading the app. In the US, if someone enters a birthday that confirms they're under 13, they'll be directed into TikTok for Younger Users, a curated viewing experience with additional safeguards and privacy protections designed specifically for this audience.  When our safety team believes that an account may belong to an underage person, the account will be suspended."
TikTok24,TikTok,2021,Advancing our approach to user safety,https://newsroom.tiktok.com/en-us/advancing-our-approach-to-user-safety,Teens (13-17),Platform,Platform,Content Recommendation Restrictions,Content Exposure,,,,,"ACCOUNT_REMOVAL, BLOCKING_DEVICES","Our zero-tolerance policies, such as posting child sexual abuse material, automatically result in an account's removal. We may also block a device to help prevent future accounts from being created."
TikTok25_1_1,TikTok,2020,Introducing Family Safety Mode and Screentime Management in Feed,https://newsroom.tiktok.com/en-gb/family-safety-mode-and-screentime-management-in-feed,Teens (13-17),Parent,Parents,Content Viewing Levels,Content Exposure,CONTROL_RESTRICTED_MODE,,,,,Screen Time Management: Control how long their teen can spend on TikTok each day. Direct Messages: Limit who can send messages to the connected account or turn off direct messaging completely. Restricted Mode: Restrict the appearance of content that may not be appropriate for all audiences.
TikTok3,TikTok,2019,TikTok's Top 10 Tips for Parents,https://newsroom.tiktok.com/en-us/tiktoks-top-10-tips-for-parents,Teens (13-17),Parent/Teen (passcode protection possible for parents),Parents & Teens,Content Recommendation Restrictions,Content Exposure,"SELECT_CONTENT_RECOMMENDATIONS, CONTENT_RESTRICTIONS",,,PASSCODE_PROTECTION_OF_RESTRICTED_MODE,,"Restricted Mode is an option that limits the appearance of content that may not be appropriate for all audiences. Restricted Mode can always be adjusted if you'd like to disable it as your teen ages, but in the meantime you can set it behind a passcode for additional control."
TikTok4,TikTok,2019,TikTok Parental Guide,https://newsroom.tiktok.com/en-us/tiktok-parental-guide,Teens (13-17),Platform/Teen,Platform & Teens,Reporting User,Interpersonal Communication,REPORTING_CONTENT,"BLOCKING_USERS, REPORTING_USERS, BLOCKING_USERS",,,,"If someone makes a comment that violates our Community Guidelines, you can take action by reporting that comment. By blocking a user they will not be able to view your teen's content or send them messages. If your teen comes across content that may suggest immediate physical danger to another user, they should report it immediately."
TikTok3_2,TikTok,2019,Limiting unwanted content,https://newsroom.tiktok.com/en-us/limiting-unwanted-content,Teens (13-17),"Parent/Teen (only the one who enabled it, can disable it)",Parents & Teens,Content Recommendation Restrictions,Content Exposure,"SELECT_CONTENT_RECOMMENDATIONS, CONTENT_RESTRICTIONS",,,,,"f you’re a parent and your teen uses TikTok, it might make sense to enable this setting to ensure the content they are viewing is age-appropriate."
TikTok37,TikTok,2022,More ways for our community to enjoy what they love,https://newsroom.tiktok.com/en-us/more-ways-for-our-community-to-enjoy-what-they-love,Teens (13-17),Platform,Platform,Content Viewing Levels,Content Exposure,CONTENT_RESTRICTIONS,,,,,prevent content with overtly mature themes from reaching audiences between ages 13-17. 
TikTok4,TikTok,2019,TikTok Parental Guide,https://newsroom.tiktok.com/en-us/tiktok-parental-guide,Teens (13-17),"Parent/Teen (only the one who enabled it, can disable it)",Parents & Teens,Content Viewing Levels,Content Exposure,"SELECT_CONTENT_RECOMMENDATIONS, CONTENT_RESTRICTIONS",,,,,Restricted Mode is an option at the account settings level that limits the appearance of content that may not be appropriate for all audiences.
TikTok43,TikTok,2022,Strengthening enforcement of sexually suggestive content,https://newsroom.tiktok.com/en-us/strengthening-enforcement-of-sexually-suggestive-content,Teens (13-17),Platform,Platform,Content Recommendation Restrictions,Content Exposure,RECOMMENDATION_RESTRICTIONS,,,,,"To safeguard For You feeds, TikTok has policies around content categories that are not eligible for recommendation, including implied nudity, sensual content, and other content that is not suitable for all audiences over age 13. Content Levels system, which is designed to prevent certain content with more mature or complex themes from reaching audiences between ages 13-17 (teen accounts). "
TikTok43,TikTok,2022,Strengthening enforcement of sexually suggestive content,https://newsroom.tiktok.com/en-us/strengthening-enforcement-of-sexually-suggestive-content,Teens (13-17),Platform,Platform,Content Viewing Levels,Content Exposure,CONTENT_RESTRICTIONS,,,,,"To safeguard For You feeds, TikTok has policies around content categories that are not eligible for recommendation, including implied nudity, sensual content, and other content that is not suitable for all audiences over age 13. Content Levels system, which is designed to prevent certain content with more mature or complex themes from reaching audiences between ages 13-17 (teen accounts). "
TikTok48,TikTok,2023,Introducing a way to refresh your For You feed on TikTok,https://newsroom.tiktok.com/en-us/introducing-a-way-to-refresh-your-for-you-feed-on-tiktok-us,Teens (13-17),Platform,Platform,Content Viewing Levels,Content Exposure,CONTENT_RESTRICTIONS,,,,,"Filtering out content with complex or mature themes from teen accounts, powered by our Content Levels system"
TikTok49,TikTok,2023,Helping creators understand our rules with refreshed Community Guidelines,https://newsroom.tiktok.com/en-us/community-guidelines-update,Teens (13-17),Platform,Platform,Content Viewing Levels,Content Exposure,CONTENT_RESTRICTIONS,,,,,age-restrict mature content so it is only viewed by adults (18 years or older).
TikTok5,TikTok,2019,TikTok for Younger Users,https://newsroom.tiktok.com/en-us/tiktok-for-younger-users,ChildrenUnder13,Platform,Platform,Content Recommendation Restrictions,Content Exposure,EXTENSIVE_CONTENT_LIMITS,,,,,"We accommodate users under the age of 13 in a limited app experience - ""TikTok for Younger Users"" - that introduces additional safety and privacy protections designed specifically for an audience that is under 13 years old. Within TikTok for Younger Users, users are provided a viewing experience that does not permit sharing of personal information and puts extensive limitations on content and user interaction. In this ecosystem, users cannot do things like share their videos, comment on others' videos, message with users, or maintain a profile or followers."
TikTok52,TikTok,2023,Updating Family Pairing and establishing TikTok's Youth Council,https://newsroom.tiktok.com/en-us/updating-family-pairing-and-establishing-tiktoks-youth-council,Teens (13-17),Parent,Parents,Content Recommendation Restrictions,Content Exposure,PARENTAL_KEYWORD_CONTENT_RESTRICTIONS,,,,,"by default, teens can view the keywords their caregiver, The keywords caregivers add will be a personalized layer on top of our Content Levels system, which already helps to keep content with more mature or complex themes from reaching audiences between ages 13-17."
TikTok53,TikTok,2023,Our continued actions to protect the TikTok community during the Israel-Hamas war,https://newsroom.tiktok.com/en-us/our-continued-actions-to-protect-the-tiktok-community-during-the-israelhamas-war,Teens (13-17),Platform,Platform,Content Viewing Levels,Content Exposure,CONTENT_RESTRICTIONS,,,,,have prevented teen accounts from viewing over 1 million videos containing violence or graphic content.
TikTok55,TikTok,2024,"TikTok CEO Shou Chew's Opening Statement - Senate Judiciary Committee Hearing on Online Child Sexual Exploitation Crisis - January 31, 2024",https://newsroom.tiktok.com/en-us/opening-statement-senate-judiciary-committee-hearing,ChildrenUnder16,Platform,Platform,Content Recommendation Restrictions,Content Exposure,,,,,NO_RECOMMENDING_THEIR_VIDEOS,
TikTok6,TikTok,2020,Protecting against exploitative content,https://newsroom.tiktok.com/en-us/protecting-against-exploitative-content,ChildrenUnder18,Platform,Platform,Account Termination,Content Creation,,,,,"TERMINATING_ACCOUNTS, REPORTING_CASES, PHOTO_IDENTIFICATION","We prohibit content that depicts or disseminates child abuse, child nudity, or sexual exploitation of children in digital or real world format. If we become aware of any such content we will take immediate action to remove content, terminate accounts, and report cases to NCMEC and law enforcement as appropriate.  "
TikTok65,TikTok,2025,Live safety guide,https://www.tiktok.com/safety/en/live-safety-guide,Teens (13-17),Platform,Platform,Content Recommendation Restrictions,Content Exposure,"NO_RECOMMENDATION_OF_MATURE_LIVES, AGE_FILTER_FOR_LIVE_STREAMERS",,,,,"Creators must be 18+ to go LIVE and people must be 18+ to send and receive LIVE Gifts (*must be 19 to send Gifts in South Korea). Additionally, if age-restricted content is identified during the LIVE it won't be recommended for people between the ages of 13 - 17. LIVE creators are notified and can choose to disconnect co-hosts or remove guests whose LIVE content has been flagged as age-restricted."
TikTok67,TikTok,2025,Guardian's guide,https://www.tiktok.com/safety/en/guardians-guide,Teens (13-17),Platform,Platform,Content Recommendation Restrictions,Content Exposure,CONTENT_RESTRICTIONS,,VIEW_ONLY_EXPERIENCE,,,"In the US, we offer a curated, view-only experience for those under age 13"
TikTok67,TikTok,2025,Guardian's guide,https://www.tiktok.com/safety/en/guardians-guide,Teens (13-17),Platform,Platform,Content Viewing Levels,Content Exposure,RECOMMENDATION_RESTRICTIONS,,,,NO_RECOMMENDATION_OF_CONTENT_BY_UNDER16,"Through Content Levels, we also work to minimize content with overtly mature themes from reaching teens under 18. We don't allow content posted by accounts for teens under 16 to be recommended in the For You feed."
TikTok67,TikTok,2025,Guardian's guide,https://www.tiktok.com/safety/en/guardians-guide,Teens (13-17),Parent ,Parents,Content Viewing Levels,Content Exposure,PARENTAL_CONTROL_CONTENT,,,,,"Setting a screen time limit, customizable by the day of the week. Customizable filtering of your teen's For You feed using keywords. Customize comment controls."
TikTok67_1,TikTok,2022,More ways for our community to enjoy what they love,https://newsroom.tiktok.com/en-us/more-ways-for-our-community-to-enjoy-what-they-love,Teens (13-17),Platform,Platform,Content Viewing Levels,Content Exposure,CONTENT_RESTRICTIONS,,,,,"When we detect that a video contains mature or complex themes, for example, fictional scenes that may be too frightening or intense for younger audiences, a maturity score will be allocated to the video to help prevent those under 18 from viewing it across the TikTok experience."
TikTok7,TikTok,2020,TikTok introduces Family Pairing,https://newsroom.tiktok.com/en-us/tiktok-introduces-family-pairing,Teens (13-17),Parent,Parents,Content Viewing Levels,Content Exposure,CONTENT_RESTRICTIONS,,,,,Family Pairing will allow a parent to link their TikTok account to their teen's and set controls
TikTok8,TikTok,2020,From our family to yours,https://newsroom.tiktok.com/en-us/from-our-family-to-yours,ChildrenUnder18,Parent,Parents,Content Viewing Levels,Content Exposure,CONTENT_RESTRICTIONS,,,,,"Family Pairing will allow parents/guardians to access the safety and privacy settings of their children's TikTok account and set controls for Direct Message access, Screen Time Management, and Restricted Mode."
YouTube1,YouTube,2019,More updates on our actions related to the safety of minors on YouTube,https://blog.youtube/news-and-events/more-updates-on-our-actions-related-to/,ChildrenUnder18,Platform,Platform,Reporting Content,Content Exposure,,,REPORT_CREATOR,,,Videos encouraging harmful and dangerous challenges targeting any audience are also clearly against our policies. We will continue to take action when creators violate our policies in ways that blatantly harm the broader user and creator community. Please continue to flag these to us.
YouTube10,YouTube,2022,Safer Internet Day: 4 Ways to Improve Your YouTube Experience,https://blog.youtube/news-and-events/safer-internet-day-2022-tips/,ChildrenUnder13,Parents,Parents,Content Viewing Levels,Content Exposure,CONTENT_SETTINGS,,,,,"We focus on including videos that are age-appropriate and high-quality on the app; you can choose from three age-based content levels (Preschool, Younger, Older) or decide to hand-pick only the videos, channels, and collections of content you want your child to watch."
YouTube10,YouTube,2022,Safer Internet Day: 4 Ways to Improve Your YouTube Experience,https://blog.youtube/news-and-events/safer-internet-day-2022-tips/,ChildrenOver9,Parents,Parents,Content Viewing Levels,Content Exposure,CONTENT_SETTINGS,,,,,"This supervised experience allows you to link your child’s Google Account to your own before choosing from three content settings (Explore, Explore more, Most of YouTube) that generally align with content ratings for pre-teens and older. "
YouTube11,YouTube,2023,4 ways we’re empowering viewers of all ages to experience a safer internet,https://blog.youtube/news-and-events/empowering-viewers-of-all-ages-to-safer-internet/,ChildrenUnder13,Parents,Parents,Content Approval,Content Exposure,CONTENT_APPROVAL,,,,,"block content or approve specific channels and videos,"
YouTube11,YouTube,2023,4 ways we’re empowering viewers of all ages to experience a safer internet,https://blog.youtube/news-and-events/empowering-viewers-of-all-ages-to-safer-internet/,ChildrenUnder13,Parents,Parents,Content Removal,Content Exposure,BLOCK_CONTENT,,,,,"block content or approve specific channels and videos,"
YouTube12,YouTube,2023,An updated approach to eating disorder-related content,https://blog.youtube/news-and-events/an-updated-approach-to-eating-disorder-related-content/,ChildrenUnder18,Platform,Platform,Content Viewing Levels,Content Exposure,AGE_RESTRICTION,,,,,"so we’re introducing age restrictions on certain content about eating disorders. As a result, some videos will not be available to viewers under 18, if you’re signed out, or if the video is embedded on another website."
